[
  {
    "schema_version": "0.1.0",
    "id": "urn:lex-mx:federal:statute:lnetb:article:1:reference:46-48:25:direct",
    "source_provision_id": "urn:lex-mx:federal:statute:lnetb:article:1",
    "source_span": "25",
    "start_char": 46,
    "end_char": 48,
    "target_instrument_id": "urn:lex-mx:federal:constitution:cpeum",
    "target_provision_id": "urn:lex-mx:federal:constitution:cpeum:article:25",
    "qualifiers": [],
    "basis": "express_cross_reference",
    "confidence": 1.0,
    "resolution_status": "resolved",
    "reference_form": "direct"
  },
  {
    "schema_version": "0.1.0",
    "id": "urn:lex-mx:federal:statute:lnetb:article:103:reference:40-57:102:relative",
    "source_provision_id": "urn:lex-mx:federal:statute:lnetb:article:103",
    "source_span": "artículo anterior",
    "start_char": 40,
    "end_char": 57,
    "target_instrument_id": "urn:lex-mx:federal:statute:lnetb",
    "target_provision_id": "urn:lex-mx:federal:statute:lnetb:article:102",
    "qualifiers": [],
    "basis": "express_cross_reference",
    "confidence": 1.0,
    "resolution_status": "resolved",
    "reference_form": "relative"
  },
  {
    "schema_version": "0.1.0",
    "id": "urn:lex-mx:federal:statute:lnetb:article:110:reference:135-138:108:direct",
    "source_provision_id": "urn:lex-mx:federal:statute:lnetb:article:110",
    "source_span": "108",
    "start_char": 135,
    "end_char": 138,
    "target_instrument_id": "urn:lex-mx:federal:statute:lnetb",
    "target_provision_id": "urn:lex-mx:federal:statute:lnetb:article:108",
    "qualifiers": [],
    "basis": "express_cross_reference",
    "confidence": 1.0,
    "resolution_status": "resolved",
    "reference_form": "direct"
  },
  {
    "schema_version": "0.1.0",
    "id": "urn:lex-mx:federal:statute:lnetb:article:27:reference:593-595:34:direct",
    "source_provision_id": "urn:lex-mx:federal:statute:lnetb:article:27",
    "source_span": "34",
    "start_char": 593,
    "end_char": 595,
    "target_instrument_id": "urn:lex-mx:federal:statute:lnetb",
    "target_provision_id": "urn:lex-mx:federal:statute:lnetb:article:34",
    "qualifiers": [],
    "basis": "express_cross_reference",
    "confidence": 1.0,
    "resolution_status": "resolved",
    "reference_form": "direct"
  },
  {
    "schema_version": "0.1.0",
    "id": "urn:lex-mx:federal:statute:lnetb:article:27:reference:598-600:37:direct",
    "source_provision_id": "urn:lex-mx:federal:statute:lnetb:article:27",
    "source_span": "37",
    "start_char": 598,
    "end_char": 600,
    "target_instrument_id": "urn:lex-mx:federal:statute:lnetb",
    "target_provision_id": "urn:lex-mx:federal:statute:lnetb:article:37",
    "qualifiers": [],
    "basis": "express_cross_reference",
    "confidence": 1.0,
    "resolution_status": "resolved",
    "reference_form": "direct"
  },
  {
    "schema_version": "0.1.0",
    "id": "urn:lex-mx:federal:statute:lnetb:article:35:reference:426-428:36:direct",
    "source_provision_id": "urn:lex-mx:federal:statute:lnetb:article:35",
    "source_span": "36",
    "start_char": 426,
    "end_char": 428,
    "target_instrument_id": "urn:lex-mx:federal:statute:lnetb",
    "target_provision_id": "urn:lex-mx:federal:statute:lnetb:article:36",
    "qualifiers": [],
    "basis": "express_cross_reference",
    "confidence": 1.0,
    "resolution_status": "resolved",
    "reference_form": "direct"
  },
  {
    "schema_version": "0.1.0",
    "id": "urn:lex-mx:federal:statute:lnetb:article:49:reference:383-385:36:direct",
    "source_provision_id": "urn:lex-mx:federal:statute:lnetb:article:49",
    "source_span": "36",
    "start_char": 383,
    "end_char": 385,
    "target_instrument_id": "urn:lex-mx:federal:statute:lnetb",
    "target_provision_id": "urn:lex-mx:federal:statute:lnetb:article:36",
    "qualifiers": [],
    "basis": "express_cross_reference",
    "confidence": 1.0,
    "resolution_status": "resolved",
    "reference_form": "direct"
  }
]