[
  {
    "schema_version": "0.1.0",
    "id": "urn:lex-mx:federal:statute:lpo:article:43:reference:803-804:3:direct",
    "source_provision_id": "urn:lex-mx:federal:statute:lpo:article:43",
    "source_span": "3",
    "start_char": 803,
    "end_char": 804,
    "target_instrument_id": "urn:lex-mx:federal:statute:lpo",
    "target_provision_id": "urn:lex-mx:federal:statute:lpo:article:3",
    "qualifiers": [
      {
        "qualifier_type": "fraction",
        "text": "fracción X",
        "start_char": 779,
        "end_char": 789
      }
    ],
    "basis": "express_cross_reference",
    "confidence": 1.0,
    "resolution_status": "resolved",
    "reference_form": "direct"
  },
  {
    "schema_version": "0.1.0",
    "id": "urn:lex-mx:federal:statute:lpo:article:43:reference:1052-1054:27:direct",
    "source_provision_id": "urn:lex-mx:federal:statute:lpo:article:43",
    "source_span": "27",
    "start_char": 1052,
    "end_char": 1054,
    "target_instrument_id": "urn:lex-mx:federal:statute:lpo",
    "target_provision_id": "urn:lex-mx:federal:statute:lpo:article:27",
    "qualifiers": [],
    "basis": "express_cross_reference",
    "confidence": 1.0,
    "resolution_status": "resolved",
    "reference_form": "direct"
  },
  {
    "schema_version": "0.1.0",
    "id": "urn:lex-mx:federal:statute:lpo:article:44:reference:212-229:43:relative",
    "source_provision_id": "urn:lex-mx:federal:statute:lpo:article:44",
    "source_span": "artículo anterior",
    "start_char": 212,
    "end_char": 229,
    "target_instrument_id": "urn:lex-mx:federal:statute:lpo",
    "target_provision_id": "urn:lex-mx:federal:statute:lpo:article:43",
    "qualifiers": [
      {
        "qualifier_type": "fraction",
        "text": "Fracciones I, II, III, IV y VI",
        "start_char": 177,
        "end_char": 207
      }
    ],
    "basis": "express_cross_reference",
    "confidence": 1.0,
    "resolution_status": "resolved",
    "reference_form": "relative"
  },
  {
    "schema_version": "0.1.0",
    "id": "urn:lex-mx:federal:statute:lpo:article:45:reference:53-55:43:direct",
    "source_provision_id": "urn:lex-mx:federal:statute:lpo:article:45",
    "source_span": "43",
    "start_char": 53,
    "end_char": 55,
    "target_instrument_id": "urn:lex-mx:federal:statute:lpo",
    "target_provision_id": "urn:lex-mx:federal:statute:lpo:article:43",
    "qualifiers": [
      {
        "qualifier_type": "fraction",
        "text": "fracción V",
        "start_char": 29,
        "end_char": 39
      }
    ],
    "basis": "express_cross_reference",
    "confidence": 1.0,
    "resolution_status": "resolved",
    "reference_form": "direct"
  },
  {
    "schema_version": "0.1.0",
    "id": "urn:lex-mx:federal:statute:lpo:article:46:reference:100-102:43:direct",
    "source_provision_id": "urn:lex-mx:federal:statute:lpo:article:46",
    "source_span": "43",
    "start_char": 100,
    "end_char": 102,
    "target_instrument_id": "urn:lex-mx:federal:statute:lpo",
    "target_provision_id": "urn:lex-mx:federal:statute:lpo:article:43",
    "qualifiers": [
      {
        "qualifier_type": "fraction",
        "text": "fracciones II, III, V y VI",
        "start_char": 60,
        "end_char": 86
      }
    ],
    "basis": "express_cross_reference",
    "confidence": 1.0,
    "resolution_status": "resolved",
    "reference_form": "direct"
  },
  {
    "schema_version": "0.1.0",
    "id": "urn:lex-mx:federal:statute:lpo:article:47:reference:397-399:43:direct",
    "source_provision_id": "urn:lex-mx:federal:statute:lpo:article:47",
    "source_span": "43",
    "start_char": 397,
    "end_char": 399,
    "target_instrument_id": "urn:lex-mx:federal:statute:lpo",
    "target_provision_id": "urn:lex-mx:federal:statute:lpo:article:43",
    "qualifiers": [
      {
        "qualifier_type": "fraction",
        "text": "fracciones III y IV",
        "start_char": 364,
        "end_char": 383
      }
    ],
    "basis": "express_cross_reference",
    "confidence": 1.0,
    "resolution_status": "resolved",
    "reference_form": "direct"
  },
  {
    "schema_version": "0.1.0",
    "id": "urn:lex-mx:federal:statute:lpo:transitory:quinto:reference:247-248:4:direct",
    "source_provision_id": "urn:lex-mx:federal:statute:lpo:transitory:quinto",
    "source_span": "4",
    "start_char": 247,
    "end_char": 248,
    "target_instrument_id": "urn:lex-mx:federal:statute:lpo",
    "target_provision_id": "urn:lex-mx:federal:statute:lpo:article:4",
    "qualifiers": [
      {
        "qualifier_type": "paragraph",
        "text": "segundo párrafo",
        "start_char": 218,
        "end_char": 233
      }
    ],
    "basis": "express_cross_reference",
    "confidence": 1.0,
    "resolution_status": "resolved",
    "reference_form": "direct"
  }
]